{
  "schema_version": "1.0.0",
  "assessment_id": "MODEL-ASSESSMENT-FIXTURE-001",
  "workspace_id": "WS-DEMO",
  "case_revision_id": "CASE-DEMO-001-R1",
  "model_ref": "MODEL-FIXTURE-NOT-EXECUTED",
  "model_version": "not-selected",
  "question_of_interest": "Достаточно ли данных для количественного сравнения экспозиций?",
  "context_of_use": "Контрактная демонстрация отказа при отсутствии продуктового контекста.",
  "role": "quantitative_prediction",
  "model_influence": "Количественный результат мог бы изменить выбор кандидата.",
  "consequence_of_wrong_decision": "Выбор неподходящего направления разработки.",
  "risk_rationale": "Нет данных о продукте, дозе и конкретной оценённой модели.",
  "input_domain_description": "Не установлена: модель не выбрана.",
  "evaluation_criteria": [
    "До расчёта должны быть заданы модель, контекст, входы и план проверки."
  ],
  "validation_evidence_refs": [],
  "limitations": [
    "Это синтетический пример; расчёт не запускался."
  ],
  "decision": "insufficient",
  "reviewer_ref": null,
  "created_at": "2026-10-18T00:00:00Z"
}
